{
  "$schema": "./canonical-permissions.schema.json",
  "catalogType": "canonical-rbac-permissions",
  "version": "2.0.0",
  "riskClasses": ["READ", "WRITE", "DESTRUCTIVE", "APPROVAL", "TERMINAL", "EXPORT", "ADMINISTRATIVE"],
  "standardCatalog": {
    "expansion": "cartesian-product:<resource>.<action>",
    "resources": ["equipment", "assignment", "rental", "deur", "billing", "collections", "maintenance", "dailyLog", "customer", "project", "operator", "reports", "users", "settings", "masterData"],
    "actions": [
      { "action": "read", "riskClass": "READ", "description": "View lists, details, and permitted state." },
      { "action": "create", "riskClass": "WRITE", "description": "Create a new record." },
      { "action": "update", "riskClass": "WRITE", "description": "Edit a non-terminal record." },
      { "action": "delete", "riskClass": "DESTRUCTIVE", "description": "Delete, archive, void, or soft-delete a record." },
      { "action": "approve", "riskClass": "APPROVAL", "description": "Accept, reject, or authorize a controlled transition." },
      { "action": "close", "riskClass": "TERMINAL", "description": "Complete, finalize, lock, settle, or terminally close a record." },
      { "action": "export", "riskClass": "EXPORT", "description": "Download or extract permitted business data." }
    ]
  },
  "workflowPermissions": [
    { "code": "dashboard.read", "resource": "dashboard", "action": "read", "riskClass": "READ", "description": "View dashboard information within scope.", "active": true },
    { "code": "dashboard.export", "resource": "dashboard", "action": "export", "riskClass": "EXPORT", "description": "Export approved dashboard evidence.", "active": true },
    { "code": "dashboard.executive.read", "resource": "dashboard", "action": "executive.read", "riskClass": "READ", "description": "View executive dashboard and KPI summaries.", "active": true },
    { "code": "dashboard.financial.read", "resource": "dashboard", "action": "financial.read", "riskClass": "READ", "description": "View financial dashboard and KPI summaries.", "active": true },
    { "code": "equipment.restore", "resource": "equipment", "action": "restore", "riskClass": "WRITE", "description": "Restore archived equipment.", "active": true },
    { "code": "equipment.status.update", "resource": "equipment", "action": "status.update", "riskClass": "WRITE", "description": "Change operational equipment status.", "active": true },
    { "code": "equipment.assignment.coordinate", "resource": "equipment", "action": "assignment.coordinate", "riskClass": "WRITE", "description": "Coordinate equipment assignment availability.", "active": true },
    { "code": "equipment.maintenanceState.update", "resource": "equipment", "action": "maintenanceState.update", "riskClass": "WRITE", "description": "Update maintenance-derived equipment state.", "active": true },
    { "code": "assignment.operator.replace", "resource": "assignment", "action": "operator.replace", "riskClass": "WRITE", "description": "Replace the assigned operator.", "active": true },
    { "code": "assignment.equipment.replace", "resource": "assignment", "action": "equipment.replace", "riskClass": "WRITE", "description": "Replace assigned equipment.", "active": true },
    { "code": "assignment.complete", "resource": "assignment", "action": "complete", "riskClass": "TERMINAL", "description": "Complete an assignment.", "active": true },
    { "code": "assignment.reopen", "resource": "assignment", "action": "reopen", "riskClass": "APPROVAL", "description": "Reopen a completed assignment.", "active": true },
    { "code": "rental.release", "resource": "rental", "action": "release", "riskClass": "APPROVAL", "description": "Release Rental equipment.", "active": true },
    { "code": "rental.return", "resource": "rental", "action": "return", "riskClass": "TERMINAL", "description": "Return Rental equipment.", "active": true },
    { "code": "rental.activate", "resource": "rental", "action": "activate", "riskClass": "WRITE", "description": "Activate a released Rental.", "active": true },
    { "code": "rental.commercialTerms.read", "resource": "rental", "action": "commercialTerms.read", "riskClass": "READ", "description": "View Rental commercial terms.", "active": true },
    { "code": "rental.commercialTerms.update", "resource": "rental", "action": "commercialTerms.update", "riskClass": "WRITE", "description": "Update mutable Rental commercial terms.", "active": true },
    { "code": "rental.customerContact.update", "resource": "rental", "action": "customerContact.update", "riskClass": "WRITE", "description": "Update the snapshotted customer review recipient.", "active": true },
    { "code": "rental.approval.submit", "resource": "rental", "action": "approval.submit", "riskClass": "WRITE", "description": "Submit a Rental for approval.", "active": true },
    { "code": "rental.approval.decide", "resource": "rental", "action": "approval.decide", "riskClass": "APPROVAL", "description": "Approve or reject a Rental.", "active": true },
    { "code": "deur.submit", "resource": "deur", "action": "submit", "riskClass": "TERMINAL", "description": "Submit DEUR evidence for review.", "active": true },
    { "code": "deur.acknowledge", "resource": "deur", "action": "acknowledge", "riskClass": "APPROVAL", "description": "Acknowledge reviewed DEUR evidence.", "active": true },
    { "code": "deur.reject", "resource": "deur", "action": "reject", "riskClass": "APPROVAL", "description": "Reject DEUR evidence with reason.", "active": true },
    { "code": "deur.reopen", "resource": "deur", "action": "reopen", "riskClass": "APPROVAL", "description": "Reopen a reviewed DEUR.", "active": true },
    { "code": "deur.correct", "resource": "deur", "action": "correct", "riskClass": "APPROVAL", "description": "Create a governed DEUR correction revision.", "active": true },
    { "code": "deur.activity.start", "resource": "deur", "action": "activity.start", "riskClass": "WRITE", "description": "Start or change a DEUR activity.", "active": true },
    { "code": "deur.activity.stop", "resource": "deur", "action": "activity.stop", "riskClass": "WRITE", "description": "Stop the current DEUR activity.", "active": true },
    { "code": "deur.evidence.update", "resource": "deur", "action": "evidence.update", "riskClass": "WRITE", "description": "Update mutable operational evidence.", "active": true },
    { "code": "deur.customerReview.issue", "resource": "deur", "action": "customerReview.issue", "riskClass": "APPROVAL", "description": "Issue a controlled customer review request.", "active": true },
    { "code": "deur.managerReview.issue", "resource": "deur", "action": "managerReview.issue", "riskClass": "APPROVAL", "description": "Issue a controlled manager review request.", "active": true },
    { "code": "billing.finalize", "resource": "billing", "action": "finalize", "riskClass": "TERMINAL", "description": "Finalize and lock a billing statement.", "active": true },
    { "code": "billing.reopen", "resource": "billing", "action": "reopen", "riskClass": "APPROVAL", "description": "Reopen a governed billing statement.", "active": true },
    { "code": "billing.invoice.issue", "resource": "billing", "action": "invoice.issue", "riskClass": "TERMINAL", "description": "Issue an invoice document.", "active": true },
    { "code": "billing.invoice.void", "resource": "billing", "action": "invoice.void", "riskClass": "DESTRUCTIVE", "description": "Void an issued invoice.", "active": true },
    { "code": "billing.invoice.export", "resource": "billing", "action": "invoice.export", "riskClass": "EXPORT", "description": "Export an invoice document.", "active": true },
    { "code": "collections.reverse", "resource": "collections", "action": "reverse", "riskClass": "APPROVAL", "description": "Reverse a collection through a governed workflow.", "active": true },
    { "code": "collections.reconcile", "resource": "collections", "action": "reconcile", "riskClass": "APPROVAL", "description": "Reconcile collection and billing evidence.", "active": true },
    { "code": "maintenance.schedule", "resource": "maintenance", "action": "schedule", "riskClass": "WRITE", "description": "Schedule maintenance.", "active": true },
    { "code": "maintenance.start", "resource": "maintenance", "action": "start", "riskClass": "WRITE", "description": "Start maintenance work.", "active": true },
    { "code": "maintenance.complete", "resource": "maintenance", "action": "complete", "riskClass": "TERMINAL", "description": "Complete maintenance work.", "active": true },
    { "code": "maintenance.cancel", "resource": "maintenance", "action": "cancel", "riskClass": "APPROVAL", "description": "Cancel scheduled or active maintenance.", "active": true },
    { "code": "users.activate", "resource": "users", "action": "activate", "riskClass": "ADMINISTRATIVE", "description": "Activate an application user.", "active": true },
    { "code": "users.deactivate", "resource": "users", "action": "deactivate", "riskClass": "ADMINISTRATIVE", "description": "Deactivate an application user.", "active": true },
    { "code": "users.password.reset", "resource": "users", "action": "password.reset", "riskClass": "ADMINISTRATIVE", "description": "Reset an application user's authentication credential.", "active": true },
    { "code": "users.access.reset", "resource": "users", "action": "access.reset", "riskClass": "ADMINISTRATIVE", "description": "Reset application access without directly editing permissions.", "active": true },
    { "code": "users.auditHistory.read", "resource": "users", "action": "auditHistory.read", "riskClass": "READ", "description": "View a user's authorization audit history.", "active": true },
    { "code": "users.effectivePermissions.read", "resource": "users", "action": "effectivePermissions.read", "riskClass": "READ", "description": "View permissions derived from assigned roles.", "active": true },